,JULIAN LOCKWOOD
transponder,"['Transponder ........................................................................................................................................', ' \nTransponder', 'The transponder works in \n  conjunction with ATC \n  radar, to identify the \naircraft to controllers.', 'When operating in \ncontrolled airspace, each \naircraft is provided with a \nunique transponder code \nto accomplish this.', 'TAXI LIGHTS - ON \n \nTRANSPONDER – ALT OFF \n \nPARKING BRAKE – OFF \n \n   \n75', 'Before Takeoff \n \nALTIMETER - SET \n \nTRANSPONDER – ALT ON \n \nLANDING LIGHTS – ON \n \n(TAXI LIGHTS – OFF)', 'TRANSPONDER – ALT OFF', 'Parking \n \nPARKING BRAKE – ON \n \nSEATBELT SIGN - OFF \n \nTRANSPONDER – STBY \n \n(Standby) \n \n83']",['The transponder'],8
.....................................................................................................................................................,['Trim .....................................................................................................................................................'],[],1
autopilot,"['48 \nAutopilot Operation ....................................................................................................................................', 'Views and Controls \n \nThe X-Plane B737-800 features a detailed 3-D cockpit with a great many of the primary controls and systems modeled, including: \nFlight controls (yoke, rudder pedals, thrust levers, prop levers, condition levers), electrical systems, pneumatic systems, navigation \naids, radios, autopilot, interior and exterior lighting, and fuel systems.', '(Electronic Flight \nInstrument \nSystem) Control \nPanel \n \n \nEngine \nInstrument Panel \n/ Autopilot Panel \n \n \n \nCo-Pilot’s EFIS', 'The autopilot will steer the aircraft \nlaterally according to the programmed flight plan.', 'The autopilot will manage altitude \naccording to the programmed flight plan.', 'Pre-set altitude at which the autopilot will level off.', 'Heading Bug  Sets the desired heading for the autopilot (when in the appropriate mode).', 'For localizer and ILS approaches:  EHSI Control Panel \n \nNAV1 works in conjunction with the pilot’s EHSI, and Autopilot A. \nNAV2 works in conjunction with the first-officer’s EHSI, and Autopilot B. \n \n46', 'Autopilot Operation \n \n \n \n \n1', 'Auto Throttle Switch   \nWhen Auto Throttle is engaged, the autopilot has command of the throttles, and \nwill govern the airspeed according to the value indicated by the IAS / MACH \nDisplay.', 'When used in conjunction with the Speed Button, and Auto-Throttle, the autopilot \nand Rotary  will govern the speed according to this value.', 'The autopilot / autothrottle will follow the vertical \ncomponents of your flight plan.', 'When Heading-\nSelect mode is engaged, the autopilot will steer the aircraft according to the value \ndisplayed here.', 'The autopilot will follow the lateral components of \nyour flight plan.', 'When Altitude Hold is engaged, the autopilot will immediately level-off, and the \n8', 'When Vertical Speed mode is engaged, the autopilot will ascend, or descend at \nthe desired rate, until reaching the altitude displayed here, at which point it will \nlevel-off.', 'When VS (Vertical Speed) Mode is engaged, the autopilot will govern the rate of \nDisplay and Rotary  ascent, or descent, according to this value.', 'The CMD buttons are used to engage the autopilot, noting there are two separate \nand identical systems – A, and B. Note that, after engaging the autopilot, the \ndesired mode must still be selected subsequently.', 'The CWS buttons are used to engage Control Wheel Steering mode, whereby the \nautopilot will allow the pilot to make inputs using the control wheel, after which it \nwill hold the resulting attitude.', '\n \nCMD / A – Engages Autopilot A \nCMD / B – Engages Autopilot B \n \nCWS / A – Engages Autopilot A in Control Wheel Steering mode \nCWS / B – Engages Autopilot B in Control Wheel Steering mode \n \n \n11', '\n \n \n13  Autopilot Disengage', 'Click this button to disengage the autopilot and return full manual control to the \nflight crew.', 'Used in conjunction with the \n14  VS Button  auto-throttle, the autopilot will govern the rate of ascent, or descent, according to \nthe value indicated by the Vertical Speed Display.', 'The autopilot will level-off and \nhold the current altitude.', 'The autopilot will steer the \n16  VOR / LOC Button  aircraft laterally to intercept and track the VOR radial, or ILS localizer that is \nselected via the active Nav radio.', 'The autopilot will steer according to \nthe Heading Display / EHSI heading bug.', 'Used in conjunction with the \n19  LVL CHG Button  auto-throttle, the autopilot will maintain the current airspeed while ascending, or \ndescending to the selected altitude.', 'Used in conjunction with the auto-\nthrottle, the autopilot will maintain airspeed according to the IAS / MACH Display.', 'Engage autopilot A or B \nusing the appropriate \nCMD button \n \nArm APP mode \n \nWhile still above 1500 ft \nradar altitude, with \napproach mode active, \nengage the other \nautopilot (A or B) using \nthe appropriate CMD \nbutton \n \n53']","['autopilot', 'The autopilot', 'the autopilot', 'the \nautopilot', 'the other \nautopilot']",36
operation,"['48 \nAutopilot Operation ....................................................................................................................................', 'Operation | Toggle Yoke Visibility \n \n(The default keyboard assignment is ‘y’).', 'This will have no \neffect on the yoke operation.', 'This section covers the basics techniques for the operation of the controls that you will encounter in the cockpit of an X-Plane \naircraft.', 'Click the mouse button to \ncomplete the operation.', 'FMS Control Display Units (CDUs) \n \n \nSee the (separate) X-Plane 11 Flight Management System (FMS) Manual for comprehensive instructions in relation to the \nfunction and operation of the Flight Management System installed in this aircraft.', 'Autopilot Operation \n \n \n \n \n1', 'Below 1500 ft radar \naltitude, observe \nROLLOUT and FLARE \narm annunciations \n \n \nImmediately following \ntouch-down, disable the \nAuto-Throttle to \nfacilitate braking and \ntaxi-operations \n \n \n \n \n \n \n \n54', 'These tables do not include ground operations.']","['the yoke operation', 'the operation', 'operation']",9
....................................................................................................................................,['48 \nAutopilot Operation ....................................................................................................................................'],[],1
auto,"['49 \nAuto-Land ................................................................................................................................................', 'Standby Power & Generator Bus \n(AUTO, BAT or OFF).', 'AUTO is the normal mode \n \nand will engage the battery standby electrical \nbuses (via a relay), automatically when needed.', 'Once the engine has been started, this switch is normally set to AUTO,', 'When set to AUTO, this \nvalve opens and closes automatically, as required \nby the pneumatic systems.', 'Auto-pilot caution or \n  warning.', 'Auto-throttle caution \nor warning.', 'Illuminates \n  when the auto-pilot is engaged', 'Center Panel \n \n \n \nMulti-Function Panel \n \nThe N1 SET rotary controls \nthe maximum throttle \nsetting (as a percentage of \nN1) that may be used by \nthe auto-throttle in TOGA', 'The Anti-Skid rotary \ncontrols the braking force \nthat will be applied by the \nauto-braking system.', 'Use this switch to toggle the Auto Throttle on, or off.', 'Auto Throttle Switch   \nWhen Auto Throttle is engaged, the autopilot has command of the throttles, and \nwill govern the airspeed according to the value indicated by the IAS / MACH \nDisplay.', 'When used in conjunction with the Speed Button, and Auto-Throttle, the autopilot \nand Rotary  will govern the speed according to this value.', 'However, when in ‘auto-land’ \nmode, both are typically engaged together, to provide redundancy in case of \nfailure.', 'Used in conjunction with the \n14  VS Button  auto-throttle, the autopilot will govern the rate of ascent, or descent, according to \nthe value indicated by the Vertical Speed Display.', ' \n17  APP Button  User in conjunction with the auto-throttle and NAV-1 radio to activate a localizer or \nILS approach.', 'Used in conjunction with the \n19  LVL CHG Button  auto-throttle, the autopilot will maintain the current airspeed while ascending, or \ndescending to the selected altitude.', 'In the real aircraft, this button causes the auto-throttles \n21', 'Auto-Land \n \nThis aircraft is capable of full auto-land, provided the ILS in use if CAT-3 approved (check this using the X-Plane map).', '\n \nEven when using the \nauto-throttle, the \nselected speed must be \nmanaged by the pilot \nthroughout the \napproach phase.', 'Below 1500 ft radar \naltitude, observe \nROLLOUT and FLARE \narm annunciations \n \n \nImmediately following \ntouch-down, disable the \nAuto-Throttle to \nfacilitate braking and \ntaxi-operations \n \n \n \n \n \n \n \n54']",[],23
land,"['49 \nAuto-Land ................................................................................................................................................', 'The LAND ALT rotary is used to manually set the \nlanding altitude for the termination of the flight (in \nfeet).', 'However, when in ‘auto-land’ \nmode, both are typically engaged together, to provide redundancy in case of \nfailure.', 'Auto-Land \n \nThis aircraft is capable of full auto-land, provided the ILS in use if CAT-3 approved (check this using the X-Plane map).']",['full auto-land'],5
................................................................................................................................................,['49 \nAuto-Land ................................................................................................................................................'],[],1
planning,"['52 \nFlight Planning .............................................................................................................................................', 'Flight Planning \n \nFlight planning is the process of determining a route from origin to destination that considers fuel requirements, terrain avoidance, \nAir Traffic Control, aircraft performance, airspace restrictions and notices to airmen (NOTAMS).']",['Flight Planning \n \nFlight planning'],3
calculation,"['55 \nFuel Calculation ...........................................................................................................................................', 'Fuel Calculation \n \nNote: All calculations here are based on the X-Plane B737-800, and NOT the real-life B737-800.', ' \nSetting the Weight, Balance and Fuel in X-Plane \n \nAfter calculating your fuel requirements (see Fuel Calculation) and referencing the Load Sheet Tables, you are ready to configure \nthe weight, balance and fuel for your upcoming flight.']",[],4
load,"['\nLoad Sheet Tables .......................................................................................................................................', 'Load Sheet Tables \n \nThe tables below illustrate a series of hypothetical load-sheet scenarios.', ' \nSetting the Weight, Balance and Fuel in X-Plane \n \nAfter calculating your fuel requirements (see Fuel Calculation) and referencing the Load Sheet Tables, you are ready to configure \nthe weight, balance and fuel for your upcoming flight.', 'The example below is for the scenario highlighted in blue in the Load Sheet Tables.']",[],5
sheet,"['\nLoad Sheet Tables .......................................................................................................................................', 'Load Sheet Tables \n \nThe tables below illustrate a series of hypothetical load-sheet scenarios.', ' \nSetting the Weight, Balance and Fuel in X-Plane \n \nAfter calculating your fuel requirements (see Fuel Calculation) and referencing the Load Sheet Tables, you are ready to configure \nthe weight, balance and fuel for your upcoming flight.', 'The example below is for the scenario highlighted in blue in the Load Sheet Tables.']",[],5
tables,"['\nLoad Sheet Tables .......................................................................................................................................', 'Load Sheet Tables \n \nThe tables below illustrate a series of hypothetical load-sheet scenarios.', ' \nSetting the Weight, Balance and Fuel in X-Plane \n \nAfter calculating your fuel requirements (see Fuel Calculation) and referencing the Load Sheet Tables, you are ready to configure \nthe weight, balance and fuel for your upcoming flight.', 'The example below is for the scenario highlighted in blue in the Load Sheet Tables.']","['The tables', 'These tables']",4
weight,"['Setting the Weight, Balance and Fuel in X-Plane ....................................................................................', 'A slightly larger model 200 followed \n  in 1967, with increased thrust to \ncompensate for additional weight.', 'Takeoff Weight  -----------------------------------------  174,000 lbs. /', 'Landing Weight  -----------------------------------------  145,500 lbs. / 66,000 kg.', '\n \nEmpty Operating Weight  -----------------------------------------  91,700 lbs. /', 'For these purposes, passengers are deemed to have an average weight of 165 lbs.', ' \nSetting the Weight, Balance and Fuel in X-Plane \n \nAfter calculating your fuel requirements (see Fuel Calculation) and referencing the Load Sheet Tables, you are ready to configure \nthe weight, balance and fuel for your upcoming flight.', 'Select the B737-800 from the flight menu, and click on the ‘Customize’ button, \nfollowed by the ‘Weight, Balance & Fuel’ button.', 'Now input the Center of Gravity, Payload Weight, Fuel Weight (Fuel Tank 1) and \nFuel Weight (Fuel Tank 2) and Fuel Weight (Fuel Tank 3).']","['additional weight', 'an average weight', 'the weight']",13
balance,"['Setting the Weight, Balance and Fuel in X-Plane ....................................................................................', ' \nSetting the Weight, Balance and Fuel in X-Plane \n \nAfter calculating your fuel requirements (see Fuel Calculation) and referencing the Load Sheet Tables, you are ready to configure \nthe weight, balance and fuel for your upcoming flight.', 'Select the B737-800 from the flight menu, and click on the ‘Customize’ button, \nfollowed by the ‘Weight, Balance & Fuel’ button.']",['balance'],4
checklists,['Checklists .................................................................................................................................................... 63'],['the checklists'],1
....................................................................................................................................................,['Checklists .................................................................................................................................................... 63'],[],1
exterior,"['Pre-Flight Exterior Inspection .................................................................................................................', 'Pre-Flight Exterior Inspection \n \nA Pre-Flight Inspection should always precede flight in any aircraft.']",[],2
inspection,"['Pre-Flight Exterior Inspection .................................................................................................................', 'Pre-Flight Exterior Inspection \n \nA Pre-Flight Inspection should always precede flight in any aircraft.', 'The purpose of this inspection is to ensure the aircraft is in a \nstate of readiness for the upcoming flight.', 'In X-Plane, a pre-flight inspection is not merely undertaken to simulate reality, but does in fact have real purpose, because the \ncontrol surfaces of the aircraft interact directly with the airflow over and around them, just as in real life.']","['this inspection', 'a pre-flight inspection']",5
dark,"['Cold and Dark to Engine Start .................................................................................................................', 'Cold and Dark to Engine Start \n \nThe following check list is a sub-set of the real procedures, and includes only the essential steps leading to engine start: \nPARKING BRAKE – ON \n \nBATTERY MASTER – ON \n \nSTANDBY POWER –']",[],2
start,"['Cold and Dark to Engine Start .................................................................................................................', 'These are \nmanually actuated by the \nflight crew to introduce fuel \nto the engines during the \nstart procedure.', 'Forward Overhead Panel \n \nThe forward overhead panel comprises a collection of smaller panels that manage the aircraft’s electrical, pneumatic, lighting, \npressurization, engine start, and other systems.', 'These are powered by the APU \nturbine at the rear of the aircraft, which is a \npreliminary source of power prior to engine start.', 'APU and Engine start / External Lights', 'Starting the APU is accomplished by holding the switch in the START position for a few seconds, then releasing back to the ON \nposition.', 'The engine ignition system in use is controlled by the switch located between the two engine start rotaries.', 'Engine start is accomplished by turning the left or right engine rotary control to GND until the start sequence has been completed \n(covered in detail in the checklists later in this guide).', 'The aft overhead panel comprises a collection of smaller panels that manage the aircraft’s electrical, pneumatic, lighting, \npressurization, engine start, and other systems.', 'Start, Hold and Reset the \nchronometer timer using the \nCHR button at the upper-left.', 'Cold and Dark to Engine Start \n \nThe following check list is a sub-set of the real procedures, and includes only the essential steps leading to engine start: \nPARKING BRAKE – ON \n \nBATTERY MASTER – ON \n \nSTANDBY POWER –', 'GROUND POWER – ON \n \nAPU – START', 'Move switch to START, then \nrelease to ON.']",['engine start'],14
taxi,"['Before Taxi ..............................................................................................................................................', 'This panel supports two main functions: APU and Engine start, and control of the external taxi, runway, and collision lights.', 'Below 1500 ft radar \naltitude, observe \nROLLOUT and FLARE \narm annunciations \n \n \nImmediately following \ntouch-down, disable the \nAuto-Throttle to \nfacilitate braking and \ntaxi-operations \n \n \n \n \n \n \n \n54', 'Add 500 lbs. of fuel for every 10-minutes of taxi-time.', 'Before Taxi \n \nSEATBELT SIGN - ON \n \nELEVATOR TRIM – SET FOR TAKEOFF \n \n(+ 10 Degrees) \n \n73', 'TAXI LIGHTS - ON \n \nTRANSPONDER – ALT OFF \n \nPARKING BRAKE – OFF \n \n   \n75', 'Before Takeoff \n \nALTIMETER - SET \n \nTRANSPONDER – ALT ON \n \nLANDING LIGHTS – ON \n \n(TAXI LIGHTS – OFF)']",['the external taxi'],7
takeoff,"['Before Takeoff.........................................................................................................................................', 'After Takeoff ...........................................................................................................................................', 'Takeoff Weight  -----------------------------------------  174,000 lbs. /', '\n \nTakeoff Distance  -----------------------------------------  8,700 ft. /', ' \nThe B737-800 is equipped \nwith a Flap lever, which \ncontrols the deployment of \nthe flaps for takeoff and \nlanding.', 'The rudders keep \nthe aircraft straight during \ntakeoff and landing, and \nhelp make coordinated \nturns.', '\n \nTAKEOFF CONFIG:', 'Takeoff \nconfiguration caution or warning.', 'When extended, the \nflaps generate more lift, \nand more drag, which is \nbeneficial during the \ntakeoff and the landing \nphases of the flight.', 'Before Taxi \n \nSEATBELT SIGN - ON \n \nELEVATOR TRIM – SET FOR TAKEOFF \n \n(+ 10 Degrees) \n \n73', 'Before Takeoff \n \nALTIMETER - SET \n \nTRANSPONDER – ALT ON \n \nLANDING LIGHTS – ON \n \n(TAXI LIGHTS – OFF)', ' \nAfter Takeoff \n \nLANDING GEAR – UP \n \nFLAPS – RETRACTED \n \nTHRUST – SET AS REQUIRED \n \n77']","['takeoff', 'the \ntakeoff']",12
cruise,"['Cruise ......................................................................................................................................................', 'These \naircraft featured FADEC controlled CFM56-7 high-bypass turbofan engines, larger and more efficient wings (without winglets in \nsome cases), a strengthened fuselage, revised avionics, and a higher cruise speed.', 'Long Range Cruise Speed  -----------------------------------------  450 KTAS', 'A good online flight planner will utilize the origin and destination airports, together with the aircraft type and equipment, the weather \nconditions, the chosen cruise altitude, known restrictions along the route, current NOTAMS, and other factors to generate a suitable \nflight plan.', 'Cruise', 'Cruise \n \nSEATBELT SIGN - OFF \n \nWING / LANDING LIGHTS - OFF \n \nALTIMETER - SET \n \n   \n78']",[],11
landing,"['Before Landing', 'After Landing ...........................................................................................................................................', 'Modifications to the landing gear to incorporate the larger engines was required.', '2,650 m. \n \nLanding Distance  -----------------------------------------  5,360 ft. / 1,635 m \n \nRange  -----------------------------------------  4,000 nm \n \nService Ceiling  -----------------------------------------  41,000 ft. / 12,500 m. \n \n   \n6', ' \nThe B737-800 is equipped \nwith a Flap lever, which \ncontrols the deployment of \nthe flaps for takeoff and \nlanding.', 'The B737-800 is equipped \nwith a Landing Gear lever.', 'To simulate this, assign a \nperipheral lever to the \n“Landing gear” property in \nX-Plane.', 'The rudders keep \nthe aircraft straight during \ntakeoff and landing, and \nhelp make coordinated \nturns.', 'The external landing lights are controlled by the switches at the left side of this panel.', 'The LAND ALT rotary is used to manually set the \nlanding altitude for the termination of the flight (in \nfeet).', 'Redundant Landing Gear Annunciators \n \nA separate set of annunciators that indicate the \nstatus of the landing gear - to provide redundancy \nin the event the primary annunciators (on the \nmain instrument panel) fail.', '\nAutomatic speed-brake \ndeployment is armed for landing.', 'When extended, the \nflaps generate more lift, \nand more drag, which is \nbeneficial during the \ntakeoff and the landing \nphases of the flight.', 'Before Takeoff \n \nALTIMETER - SET \n \nTRANSPONDER – ALT ON \n \nLANDING LIGHTS – ON \n \n(TAXI LIGHTS – OFF)', 'Cruise \n \nSEATBELT SIGN - OFF \n \nWING / LANDING LIGHTS - OFF \n \nALTIMETER - SET \n \n   \n78', 'Before Landing \n \nSEATBELT SIGN - ON \n \nALTIMETER - SET \n \nWING / LANDING LIGHTS - ON \n \n   \n79', '– RETRACTED \n \nSPEED BRAKES – RETRACTED \n \nWING / LANDING LIGHTS - OFF \n \n81']","['\nlanding', 'landing']",18
parking,"['Parking .................................................................................................................................................... 83 \n \n \n \n4', 'Cold and Dark to Engine Start \n \nThe following check list is a sub-set of the real procedures, and includes only the essential steps leading to engine start: \nPARKING BRAKE – ON \n \nBATTERY MASTER – ON \n \nSTANDBY POWER –', 'TAXI LIGHTS - ON \n \nTRANSPONDER – ALT OFF \n \nPARKING BRAKE – OFF \n \n   \n75', 'Parking \n \nPARKING BRAKE – ON \n \nSEATBELT SIGN - OFF \n \nTRANSPONDER – STBY \n \n(Standby) \n \n83']",[],5
corporation,['The Boeing corporation developed \nthe 737 in the mid-1960s to serve as'],['The Boeing corporation'],1
mid-1960,['The Boeing corporation developed \nthe 737 in the mid-1960s to serve as'],[],1
cost,"['a lower-cost twin-engined, short-\nrange companion to the larger 727 \nand 707 models.']",[],1
short-,"['a lower-cost twin-engined, short-\nrange companion to the larger 727 \nand 707 models.']",[],1
range,"['a lower-cost twin-engined, short-\nrange companion to the larger 727 \nand 707 models.', 'The new models were heavily revised, and featured winglets for increased lift and range, and CFM International \nCFM56-3C-1 high-bypass turbofan engines.', 'The MAX variants offer four lengths, with options for 138 to 230 \nseats and a range of between 3,215 and 3,825 nautical miles.', 'Long Range Cruise Speed  -----------------------------------------  450 KTAS', '2,650 m. \n \nLanding Distance  -----------------------------------------  5,360 ft. / 1,635 m \n \nRange  -----------------------------------------  4,000 nm \n \nService Ceiling  -----------------------------------------  41,000 ft. / 12,500 m. \n \n   \n6', 'The location of the aircraft is \npresented at the bottom of the screen, and the map incorporates airports, \nnavigation aids and waypoints (within the selected range) that are ahead of, and \n45 degrees either side of, this position.', 'The location of the aircraft is \npresented at the center of the screen, and the map incorporates airports, \nnavigation aids and waypoints (within the selected range) in all directions.']","['range', 'a range', 'the selected range']",7
companion,"['a lower-cost twin-engined, short-\nrange companion to the larger 727 \nand 707 models.']","['a lower-cost twin-engined, short-\nrange companion']",1
